{"schema":"oreflow.particle-benchmark/v1","source":{"doi":"10.14278/rodare.336","url":"https://doi.org/10.14278/rodare.336","license":"CC BY 4.0","sha256":"1559e6c5fabd30988ea0de60bbdf04a750f7895401ffc31da974ea4477aa50b0"},"protocol":{"train_rows":68008,"fit_rows":57806,"validation_rows":10202,"test_rows":29147,"seed":42,"features":["Aspect Ratio","Solidity","ECD","Mineral 1 surface"],"excluded_from_features":["Probability 1–4","Predicted probability 1–4","Class 1–4","Main mineral","ECD2","Mineral 1/2 modal","Mineral 2 surface"],"target":"Class 1–4 label B in the published training sheet","test_oracle":"Probability 1–4 in the published test sheet; constructed probability, not observed recovery","missingness":"Case 4 has missing oracle/reference probabilities; all model comparisons use their common finite test rows and expose the excluded count","published_reference":"Predicted probability 1–4 supplied by the source authors; not refitted here","split":"Original published Train data / Test data sheets; 15% of Train data reserved for early stopping","device":"cuda","torch_version":"2.12.0+cu126","mlp_best_epoch":52,"mlp_validation_bce":0.4446995,"metric":"RMSE, MAE and bias between predicted and constructed oracle probability","threshold_interpretation":"Expected Class B capture under the constructed oracle, not metallurgical recovery"},"standardization":{"mean":[-0.52712577,-0.00160006,2.216073,0.48019357],"scale":[0.37584175,0.12319642,0.74215791,0.49450488]},"logistic_coefficients":{"1":{"intercept":0.4234783,"weights":[0.0001308,-0.0042032,0.3308683,0.7785162]},"2":{"intercept":-0.0705191,"weights":[-0.0053439,0.010784,0.0200904,2.8860085]},"3":{"intercept":-0.7530932,"weights":[0.0345423,-0.0303338,0.6883026,-0.006662]},"4":{"intercept":-0.4665934,"weights":[0.1631055,-0.5698678,0.683319,1.0677109]}},"cases":[{"case":"1","train_class_b":40081,"test_rows":29147,"excluded_test_rows":0,"oracle_expected_b":17188.449,"models":{"published_reference":{"rmse":0.025722,"mae":0.019936,"bias":-0.000386,"calibration":[{"bin":6,"count":1235,"predicted":0.33393,"oracle":0.29381},{"bin":7,"count":3154,"predicted":0.37598,"oracle":0.3484},{"bin":8,"count":4538,"predicted":0.42609,"oracle":0.41057},{"bin":9,"count":3592,"predicted":0.473,"oracle":0.46704},{"bin":10,"count":1715,"predicted":0.52002,"oracle":0.52269},{"bin":11,"count":504,"predicted":0.57067,"oracle":0.58154},{"bin":12,"count":293,"predicted":0.62147,"oracle":0.63676},{"bin":13,"count":2173,"predicted":0.68109,"oracle":0.66301},{"bin":14,"count":4458,"predicted":0.727,"oracle":0.72697},{"bin":15,"count":5674,"predicted":0.77279,"oracle":0.79927},{"bin":16,"count":1769,"predicted":0.81572,"oracle":0.87769},{"bin":17,"count":42,"predicted":0.8569,"oracle":0.96696}],"thresholds":[{"threshold":0.0,"selected_fraction":1.0,"expected_recovery":1.0,"expected_grade_proxy":0.589716},{"threshold":0.01,"selected_fraction":1.0,"expected_recovery":1.0,"expected_grade_proxy":0.589716},{"threshold":0.02,"selected_fraction":1.0,"expected_recovery":1.0,"expected_grade_proxy":0.589716},{"threshold":0.03,"selected_fraction":1.0,"expected_recovery":1.0,"expected_grade_proxy":0.589716},{"threshold":0.04,"selected_fraction":1.0,"expected_recovery":1.0,"expected_grade_proxy":0.589716},{"threshold":0.05,"selected_fraction":1.0,"expected_recovery":1.0,"expected_grade_proxy":0.589716},{"threshold":0.06,"selected_fraction":1.0,"expected_recovery":1.0,"expected_grade_proxy":0.589716},{"threshold":0.07,"selected_fraction":1.0,"expected_recovery":1.0,"expected_grade_proxy":0.589716},{"threshold":0.08,"selected_fraction":1.0,"expected_recovery":1.0,"expected_grade_proxy":0.589716},{"threshold":0.09,"selected_fraction":1.0,"expected_recovery":1.0,"expected_grade_proxy":0.589716},{"threshold":0.1,"selected_fraction":1.0,"expected_recovery":1.0,"expected_grade_proxy":0.589716},{"threshold":0.11,"selected_fraction":1.0,"expected_recovery":1.0,"expected_grade_proxy":0.589716},{"threshold":0.12,"selected_fraction":1.0,"expected_recovery":1.0,"expected_grade_proxy":0.589716},{"threshold":0.13,"selected_fraction":1.0,"expected_recovery":1.0,"expected_grade_proxy":0.589716},{"threshold":0.14,"selected_fraction":1.0,"expected_recovery":1.0,"expected_grade_proxy":0.589716},{"threshold":0.15,"selected_fraction":1.0,"expected_recovery":1.0,"expected_grade_proxy":0.589716},{"threshold":0.16,"selected_fraction":1.0,"expected_recovery":1.0,"expected_grade_proxy":0.589716},{"threshold":0.17,"selected_fraction":1.0,"expected_recovery":1.0,"expected_grade_proxy":0.589716},{"threshold":0.18,"selected_fraction":1.0,"expected_recovery":1.0,"expected_grade_proxy":0.589716},{"threshold":0.19,"selected_fraction":1.0,"expected_recovery":1.0,"expected_grade_proxy":0.589716},{"threshold":0.2,"selected_fraction":1.0,"expected_recovery":1.0,"expected_grade_proxy":0.589716},{"threshold":0.21,"selected_fraction":1.0,"expected_recovery":1.0,"expected_grade_proxy":0.589716},{"threshold":0.22,"selected_fraction":1.0,"expected_recovery":1.0,"expected_grade_proxy":0.589716},{"threshold":0.23,"selected_fraction":1.0,"expected_recovery":1.0,"expected_grade_proxy":0.589716},{"threshold":0.24,"selected_fraction":1.0,"expected_recovery":1.0,"expected_grade_proxy":0.589716},{"threshold":0.25,"selected_fraction":1.0,"expected_recovery":1.0,"expected_grade_proxy":0.589716},{"threshold":0.26,"selected_fraction":1.0,"expected_recovery":1.0,"expected_grade_proxy":0.589716},{"threshold":0.27,"selected_fraction":1.0,"expected_recovery":1.0,"expected_grade_proxy":0.589716},{"threshold":0.28,"selected_fraction":1.0,"expected_recovery":1.0,"expected_grade_proxy":0.589716},{"threshold":0.29,"selected_fraction":1.0,"expected_recovery":1.0,"expected_grade_proxy":0.589716},{"threshold":0.3,"selected_fraction":1.0,"expected_recovery":1.0,"expected_grade_proxy":0.589716},{"threshold":0.31,"selected_fraction":1.0,"expected_recovery":1.0,"expected_grade_proxy":0.589716},{"threshold":0.32,"selected_fraction":1.0,"expected_recovery":1.0,"expected_grade_proxy":0.589716},{"threshold":0.33,"selected_fraction":0.971283,"expected_recovery":0.986011,"expected_grade_proxy":0.598658},{"threshold":0.34,"selected_fraction":0.971283,"expected_recovery":0.986011,"expected_grade_proxy":0.598658},{"threshold":0.35,"selected_fraction":0.957629,"expected_recovery":0.97889,"expected_grade_proxy":0.602809},{"threshold":0.36,"selected_fraction":0.93797,"expected_recovery":0.968158,"expected_grade_proxy":0.608696},{"threshold":0.37,"selected_fraction":0.922942,"expected_recovery":0.95967,"expected_grade_proxy":0.613183},{"threshold":0.38,"selected_fraction":0.897314,"expected_recovery":0.944684,"expected_grade_proxy":0.620848},{"threshold":0.39,"selected_fraction":0.876317,"expected_recovery":0.931933,"expected_grade_proxy":0.627143},{"threshold":0.4,"selected_fraction":0.849418,"expected_recovery":0.91496,"expected_grade_proxy":0.635219},{"threshold":0.41,"selected_fraction":0.825848,"expected_recovery":0.899624,"expected_grade_proxy":0.642397},{"threshold":0.42,"selected_fraction":0.792775,"expected_recovery":0.87738,"expected_grade_proxy":0.652651},{"threshold":0.43,"selected_fraction":0.7632,"expected_recovery":0.856863,"expected_grade_proxy":0.662088},{"threshold":0.44,"selected_fraction":0.724191,"expected_recovery":0.828978,"expected_grade_proxy":0.675045},{"threshold":0.45,"selected_fraction":0.693725,"expected_recovery":0.806565,"expected_grade_proxy":0.685638},{"threshold":0.46,"selected_fraction":0.665351,"expected_recovery":0.785118,"expected_grade_proxy":0.695868},{"threshold":0.47,"selected_fraction":0.637699,"expected_recovery":0.763672,"expected_grade_proxy":0.70621},{"threshold":0.48,"selected_fraction":0.611384,"expected_recovery":0.74274,"expected_grade_proxy":0.716417},{"threshold":0.49,"selected_fraction":0.590078,"expected_recovery":0.725355,"expected_grade_proxy":0.72491},{"threshold":0.5,"selected_fraction":0.570488,"expected_recovery":0.708963,"expected_grade_proxy":0.732858},{"threshold":0.51,"selected_fraction":0.552784,"expected_recovery":0.693817,"expected_grade_proxy":0.740171},{"threshold":0.52,"selected_fraction":0.53858,"expected_recovery":0.681374,"expected_grade_proxy":0.746068},{"threshold":0.53,"selected_fraction":0.527258,"expected_recovery":0.67123,"expected_grade_proxy":0.750742},{"threshold":0.54,"selected_fraction":0.518784,"expected_recovery":0.663478,"expected_grade_proxy":0.754193},{"threshold":0.55,"selected_fraction":0.511648,"expected_recovery":0.65681,"expected_grade_proxy":0.757028},{"threshold":0.56,"selected_fraction":0.507188,"expected_recovery":0.652543,"expected_grade_proxy":0.758723},{"threshold":0.57,"selected_fraction":0.50235,"expected_recovery":0.647832,"expected_grade_proxy":0.760499},{"threshold":0.58,"selected_fraction":0.498988,"expected_recovery":0.644487,"expected_grade_proxy":0.76167},{"threshold":0.59,"selected_fraction":0.496586,"expected_recovery":0.642046,"expected_grade_proxy":0.762455},{"threshold":0.6,"selected_fraction":0.494356,"expected_recovery":0.639758,"expected_grade_proxy":0.763166},{"threshold":0.61,"selected_fraction":0.491474,"expected_recovery":0.636738,"expected_grade_proxy":0.764016},{"threshold":0.62,"selected_fraction":0.489244,"expected_recovery":0.634356,"expected_grade_proxy":0.764628},{"threshold":0.63,"selected_fraction":0.487357,"expected_recovery":0.632311,"expected_grade_proxy":0.765114},{"threshold":0.64,"selected_fraction":0.485916,"expected_recovery":0.630714,"expected_grade_proxy":0.765445},{"threshold":0.65,"selected_fraction":0.484304,"expected_recovery":0.628904,"expected_grade_proxy":0.765789},{"threshold":0.66,"selected_fraction":0.483377,"expected_recovery":0.627863,"expected_grade_proxy":0.765987},{"threshold":0.67,"selected_fraction":0.462621,"expected_recovery":0.605346,"expected_grade_proxy":0.771653},{"threshold":0.68,"selected_fraction":0.445397,"expected_recovery":0.58609,"expected_grade_proxy":0.775996},{"threshold":0.69,"selected_fraction":0.424744,"expecte